{
  "event_type": "email.triaged",
  "entity_id": "msg_0af31c8e",
  "tenant_id": "tnt_founder",
  "payload": {
    "thread_id": "thr_92ab17",
    "label": "needs-reply",
    "reason": "renewal in flight; sender awaiting Q3 numbers",
    "by": "claude",
    "triaged_at": "2026-06-14T09:13:30Z"
  },
  "metadata": {}
}
